{
  "name": "Romanian Deadlift",
  "force": "pull",
  "level": "intermediate",
  "mechanic": "compound",
  "equipment": "barbell",
  "primaryMuscles": [
    "hamstrings"
  ],
  "secondaryMuscles": [
    "calves",
    "glutes",
    "lower back"
  ],
  "instructions": [
    "Put a barbell in front of you on the ground and grab it using a pronated (palms facing down) grip that a little wider than shoulder width. Tip: Depending on the weight used, you may need wrist wraps to perform the exercise and also a raised platform in order to allow for better range of motion.",
    "Bend the knees slightly and keep the shins vertical, hips back and back straight. This will be your starting position.",
    "Keeping your back and arms completely straight at all times, use your hips to lift the bar as you exhale. Tip: The movement should not be fast but steady and under control.",
    "Once you are standing completely straight up, lower the bar by pushing the hips back, only slightly bending the knees, unlike when squatting. Tip: Take a deep breath at the start of the movement and keep your chest up. Hold your breath as you lower and exhale as you complete the movement.",
    "Repeat for the recommended amount of repetitions."
  ],
  "category": "strength",
  "images": [
    "Romanian_Deadlift/0.jpg",
    "Romanian_Deadlift/1.jpg"
  ],
  "program": [
    {
      "slot": "lowerB.3",
      "role": "accessory",
      "sets": 3,
      "reps": "8-10",
      "rir_ceiling": 3,
      "cap": null,
      "increment": "+5/10",
      "muscle_credit": {
        "primary": {
          "hamstrings": 3
        },
        "secondary": [
          "glutes"
        ]
      }
    }
  ],
  "id": "Romanian_Deadlift"
}