{
  "name": "Reverse Flyes",
  "force": "pull",
  "level": "beginner",
  "mechanic": "isolation",
  "equipment": "dumbbell",
  "primaryMuscles": [
    "shoulders"
  ],
  "secondaryMuscles": [

  ],
  "instructions": [
    "To begin, lie down on an incline bench with the chest and stomach pressing against the incline. Have the dumbbells in each hand with the palms facing each other (neutral grip).",
    "Extend the arms in front of you so that they are perpendicular to the angle of the bench. The legs should be stationary while applying pressure with the ball of your toes. This is the starting position.",
    "Maintaining the slight bend of the elbows, move the weights out and away from each other (to the side) in an arc motion while exhaling. Tip: Try to squeeze your shoulder blades together to get the best results from this exercise.",
    "The arms should be elevated until they are parallel to the floor.",
    "Feel the contraction and slowly lower the weights back down to the starting position while inhaling.",
    "Repeat for the recommended amount of repetitions."
  ],
  "category": "strength",
  "images": [
    "Reverse_Flyes/0.jpg",
    "Reverse_Flyes/1.jpg"
  ],
  "program": [
    {
      "slot": "upperA.5",
      "role": "accessory",
      "sets": 2,
      "reps": "12-15",
      "rir_ceiling": 3,
      "cap": null,
      "increment": "+2.5",
      "muscle_credit": {
        "primary": {
          "rear_delts": 2
        },
        "secondary": []
      }
    }
  ],
  "id": "Reverse_Flyes"
}