{
  "name": "Standing Calf Raises",
  "force": "push",
  "level": "beginner",
  "mechanic": "isolation",
  "equipment": "machine",
  "primaryMuscles": [
    "calves"
  ],
  "secondaryMuscles": [

  ],
  "instructions": [
    "Adjust the padded lever of the calf raise machine to fit your height.",
    "Place your shoulders under the pads provided and position your toes facing forward (or using any of the two other positions described at the beginning of the chapter). The balls of your feet should be secured on top of the calf block with the heels extending off it. Push the lever up by extending your hips and knees until your torso is standing erect. The knees should be kept with a slight bend; never locked. Toes should be facing forward, outwards or inwards as described at the beginning of the chapter. This will be your starting position.",
    "Raise your heels as you breathe out by extending your ankles as high as possible and flexing your calf. Ensure that the knee is kept stationary at all times. There should be no bending at any time. Hold the contracted position by a second before you start to go back down.",
    "Go back slowly to the starting position as you breathe in by lowering your heels as you bend the ankles until calves are stretched.",
    "Repeat for the recommended amount of repetitions."
  ],
  "category": "strength",
  "images": [
    "Standing_Calf_Raises/0.jpg",
    "Standing_Calf_Raises/1.jpg"
  ],
  "program": [
    {
      "slot": "lowerA.6",
      "role": "accessory",
      "sets": 3,
      "reps": "12-15",
      "rir_ceiling": 3,
      "cap": null,
      "increment": "+5/10",
      "muscle_credit": {
        "primary": {
          "calves": 3
        },
        "secondary": []
      }
    }
  ],
  "id": "Standing_Calf_Raises"
}