{
  "name": "Thigh Abductor",
  "force": "push",
  "level": "beginner",
  "mechanic": "isolation",
  "equipment": "machine",
  "primaryMuscles": [
    "abductors"
  ],
  "secondaryMuscles": [
    "glutes"
  ],
  "instructions": [
    "To begin, sit down on the abductor machine and select a weight you are comfortable with. When your legs are positioned properly, grip the handles on each side. Your entire upper body (from the waist up) should be stationary. This is the starting position.",
    "Slowly press against the machine with your legs to move them away from each other while exhaling.",
    "Feel the contraction for a second and begin to move your legs back to the starting position while breathing in. Note: Remember to keep your upper body stationary to prevent any injuries from occurring.",
    "Repeat for the recommended amount of repetitions."
  ],
  "category": "strength",
  "images": [
    "Thigh_Abductor/0.jpg",
    "Thigh_Abductor/1.jpg"
  ],
  "program": [
    {
      "slot": "lowerA.5",
      "role": "accessory",
      "sets": 4,
      "reps": "12-15",
      "rir_ceiling": 3,
      "cap": null,
      "increment": "+5/10",
      "muscle_credit": {
        "primary": {
          "hip_abductors": 4
        },
        "secondary": [
          "glutes"
        ]
      }
    }
  ],
  "id": "Thigh_Abductor"
}