{
  "name": "Seated Calf Raise",
  "force": "push",
  "level": "beginner",
  "mechanic": "isolation",
  "equipment": "machine",
  "primaryMuscles": [
    "calves"
  ],
  "secondaryMuscles": [

  ],
  "instructions": [
    "Sit on the machine and place your toes on the lower portion of the platform provided with the heels extending off. Choose the toe positioning of your choice (forward, in, or out) as per the beginning of this chapter.",
    "Place your lower thighs under the lever pad, which will need to be adjusted according to the height of your thighs. Now place your hands on top of the lever pad in order to prevent it from slipping forward.",
    "Lift the lever slightly by pushing your heels up and release the safety bar. This will be your starting position.",
    "Slowly lower your heels by bending at the ankles until the calves are fully stretched. Inhale as you perform this movement.",
    "Raise the heels by extending the ankles as high as possible as you contract the calves and breathe out. Hold the top contraction for a second.",
    "Repeat for the recommended amount of repetitions."
  ],
  "category": "strength",
  "images": [
    "Seated_Calf_Raise/0.jpg",
    "Seated_Calf_Raise/1.jpg"
  ],
  "program": [
    {
      "slot": "lowerB.7",
      "role": "accessory",
      "sets": 3,
      "reps": "10-15",
      "rir_ceiling": 3,
      "cap": null,
      "increment": "+5/10",
      "muscle_credit": {
        "primary": {
          "calves": 3
        },
        "secondary": []
      }
    }
  ],
  "id": "Seated_Calf_Raise"
}