{
  "name": "Wide-Grip Lat Pulldown",
  "force": "pull",
  "level": "beginner",
  "mechanic": "compound",
  "equipment": "cable",
  "primaryMuscles": [
    "lats"
  ],
  "secondaryMuscles": [
    "biceps",
    "middle back",
    "shoulders"
  ],
  "instructions": [
    "Sit down on a pull-down machine with a wide bar attached to the top pulley. Make sure that you adjust the knee pad of the machine to fit your height. These pads will prevent your body from being raised by the resistance attached to the bar.",
    "Grab the bar with the palms facing forward using the prescribed grip. Note on grips: For a wide grip, your hands need to be spaced out at a distance wider than shoulder width. For a medium grip, your hands need to be spaced out at a distance equal to your shoulder width and for a close grip at a distance smaller than your shoulder width.",
    "As you have both arms extended in front of you holding the bar at the chosen grip width, bring your torso back around 30 degrees or so while creating a curvature on your lower back and sticking your chest out. This is your starting position.",
    "As you breathe out, bring the bar down until it touches your upper chest by drawing the shoulders and the upper arms down and back. Tip: Concentrate on squeezing the back muscles once you reach the full contracted position. The upper torso should remain stationary and only the arms should move. The forearms should do no other work except for holding the bar; therefore do not try to pull down the bar using the forearms.",
    "After a second at the contracted position squeezing your shoulder blades together, slowly raise the bar back to the starting position when your arms are fully extended and the lats are fully stretched. Inhale during this portion of the movement.",
    "Repeat this motion for the prescribed amount of repetitions."
  ],
  "category": "strength",
  "images": [
    "Wide-Grip_Lat_Pulldown/0.jpg",
    "Wide-Grip_Lat_Pulldown/1.jpg"
  ],
  "program": [
    {
      "slot": "upperB.1",
      "role": "anchor",
      "sets": 3,
      "reps": "8-10",
      "rir_ceiling": 3,
      "cap": null,
      "increment": "+5/10",
      "muscle_credit": {
        "primary": {
          "back": 3
        },
        "secondary": [
          "biceps"
        ]
      }
    }
  ],
  "id": "Wide-Grip_Lat_Pulldown"
}