{
  "name": "Triceps Pushdown",
  "force": "push",
  "level": "beginner",
  "mechanic": "isolation",
  "equipment": "cable",
  "primaryMuscles": [
    "triceps"
  ],
  "secondaryMuscles": [

  ],
  "instructions": [
    "Attach a straight or angled bar to a high pulley and grab with an overhand grip (palms facing down) at shoulder width.",
    "Standing upright with the torso straight and a very small inclination forward, bring the upper arms close to your body and perpendicular to the floor. The forearms should be pointing up towards the pulley as they hold the bar. This is your starting position.",
    "Using the triceps, bring the bar down until it touches the front of your thighs and the arms are fully extended perpendicular to the floor. The upper arms should always remain stationary next to your torso and only the forearms should move. Exhale as you perform this movement.",
    "After a second hold at the contracted position, bring the bar slowly up to the starting point. Breathe in as you perform this step.",
    "Repeat for the recommended amount of repetitions."
  ],
  "category": "strength",
  "images": [
    "Triceps_Pushdown/0.jpg",
    "Triceps_Pushdown/1.jpg"
  ],
  "program": [
    {
      "slot": "upperA.6",
      "role": "accessory",
      "sets": 3,
      "reps": "10-12",
      "rir_ceiling": 3,
      "cap": null,
      "increment": "+5/10",
      "muscle_credit": {
        "primary": {
          "triceps": 3
        },
        "secondary": []
      }
    }
  ],
  "id": "Triceps_Pushdown"
}