{
  "name": "Seated Leg Curl",
  "force": "pull",
  "level": "beginner",
  "mechanic": "isolation",
  "equipment": "machine",
  "primaryMuscles": [
    "hamstrings"
  ],
  "secondaryMuscles": [

  ],
  "instructions": [
    "Adjust the machine lever to fit your height and sit on the machine with your back against the back support pad.",
    "Place the back of lower leg on top of padded lever (just a few inches under the calves) and secure the lap pad against your thighs, just above the knees. Then grasp the side handles on the machine as you point your toes straight (or you can also use any of the other two stances) and ensure that the legs are fully straight right in front of you. This will be your starting position.",
    "As you exhale, pull the machine lever as far as possible to the back of your thighs by flexing at the knees. Keep your torso stationary at all times. Hold the contracted position for a second.",
    "Slowly return to the starting position as you breathe in.",
    "Repeat for the recommended amount of repetitions."
  ],
  "category": "strength",
  "images": [
    "Seated_Leg_Curl/0.jpg",
    "Seated_Leg_Curl/1.jpg"
  ],
  "program": [
    {
      "slot": "lowerB.4",
      "role": "accessory",
      "sets": 2,
      "reps": "12-15",
      "rir_ceiling": 3,
      "cap": null,
      "increment": "+5/10",
      "muscle_credit": {
        "primary": {
          "hamstrings": 2
        },
        "secondary": []
      }
    }
  ],
  "id": "Seated_Leg_Curl"
}