{
  "name": "Leverage Incline Chest Press",
  "force": "push",
  "level": "beginner",
  "mechanic": "compound",
  "equipment": "machine",
  "primaryMuscles": [
    "chest"
  ],
  "secondaryMuscles": [
    "shoulders",
    "triceps"
  ],
  "instructions": [
    "Load an appropriate weight onto the pins and adjust the seat for your height. The handles should be near the top of the pectorals at the beginning of the motion. Your chest and head should be up and your shoulder blades retracted. This will be your starting position.",
    "Press the handles forward by extending through the elbow.",
    "After a brief pause at the top, return the weight just above the start position, keeping tension on the muscles by not returning the weight to the stops until the set is complete."
  ],
  "category": "strength",
  "images": [
    "Leverage_Incline_Chest_Press/0.jpg",
    "Leverage_Incline_Chest_Press/1.jpg"
  ],
  "program": [
    {
      "slot": "upperB.3",
      "role": "accessory",
      "sets": 3,
      "reps": "10-12",
      "rir_ceiling": 3,
      "cap": null,
      "increment": "+5/10",
      "muscle_credit": {
        "primary": {
          "chest": 3
        },
        "secondary": [
          "front_delts",
          "triceps"
        ]
      }
    }
  ],
  "id": "Leverage_Incline_Chest_Press"
}