{
  "name": "Farmer's Walk",
  "force": null,
  "level": "intermediate",
  "mechanic": "compound",
  "equipment": "other",
  "primaryMuscles": [
    "forearms"
  ],
  "secondaryMuscles": [
    "abdominals",
    "glutes",
    "hamstrings",
    "lower back",
    "quadriceps",
    "traps"
  ],
  "instructions": [
    "There are various implements that can be used for the farmers walk. These can also be performed with heavy dumbbells or short bars if these implements aren't available. Begin by standing between the implements.",
    "After gripping the handles, lift them up by driving through your heels, keeping your back straight and your head up.",
    "Walk taking short, quick steps, and don't forget to breathe. Move for a given distance, typically 50-100 feet, as fast as possible."
  ],
  "category": "strongman",
  "images": [
    "Farmers_Walk/0.jpg",
    "Farmers_Walk/1.jpg"
  ],
  "program": [
    {
      "slot": "upperA.8",
      "role": "carry",
      "sets": 2,
      "reps": "30-40m",
      "rir_ceiling": "carry",
      "cap": "RPE8",
      "increment": "+5/10",
      "muscle_credit": {
        "primary": {
          "grip_carry": 2
        },
        "secondary": [
          "back"
        ]
      }
    },
    {
      "slot": "lowerB.8",
      "role": "carry",
      "sets": 3,
      "reps": "30-40m",
      "rir_ceiling": "carry",
      "cap": "RPE8",
      "increment": "+5/10",
      "muscle_credit": {
        "primary": {
          "grip_carry": 3
        },
        "secondary": [
          "back"
        ]
      }
    }
  ],
  "id": "Farmers_Walk"
}