{
  "name": "Thigh Adductor",
  "force": "pull",
  "level": "beginner",
  "mechanic": "isolation",
  "equipment": "machine",
  "primaryMuscles": [
    "adductors"
  ],
  "secondaryMuscles": [
    "glutes",
    "hamstrings"
  ],
  "instructions": [
    "To begin, sit down on the adductor machine and select a weight you are comfortable with. When your legs are positioned properly on the leg pads of the machine, grip the handles on each side. Your entire upper body (from the waist up) should be stationary. This is the starting position.",
    "Slowly press against the machine with your legs to move them towards each other while exhaling.",
    "Feel the contraction for a second and begin to move your legs back to the starting position while breathing in. Note: Remember to keep your upper body stationary and avoid fast jerking motions in order to prevent any injuries from occurring.",
    "Repeat for the recommended amount of repetitions."
  ],
  "category": "strength",
  "images": [
    "Thigh_Adductor/0.jpg",
    "Thigh_Adductor/1.jpg"
  ],
  "program": [
    {
      "slot": "lowerB.6",
      "role": "accessory",
      "sets": 4,
      "reps": "12-15",
      "rir_ceiling": 3,
      "cap": null,
      "increment": "+5/10",
      "muscle_credit": {
        "primary": {
          "hip_adductors": 4
        },
        "secondary": []
      }
    }
  ],
  "id": "Thigh_Adductor"
}