{
  "name": "Hammer Curls",
  "force": "pull",
  "level": "beginner",
  "mechanic": "isolation",
  "equipment": "dumbbell",
  "primaryMuscles": [
    "biceps"
  ],
  "secondaryMuscles": [

  ],
  "instructions": [
    "Stand up with your torso upright and a dumbbell on each hand being held at arms length. The elbows should be close to the torso.",
    "The palms of the hands should be facing your torso. This will be your starting position.",
    "Now, while holding your upper arm stationary, exhale and curl the weight forward while contracting the biceps. Continue to raise the weight until the biceps are fully contracted and the dumbbell is at shoulder level. Hold the contracted position for a brief moment as you squeeze the biceps. Tip: Focus on keeping the elbow stationary and only moving your forearm.",
    "After the brief pause, inhale and slowly begin the lower the dumbbells back down to the starting position.",
    "Repeat for the recommended amount of repetitions."
  ],
  "category": "strength",
  "images": [
    "Hammer_Curls/0.jpg",
    "Hammer_Curls/1.jpg"
  ],
  "program": [
    {
      "slot": "upperB.7",
      "role": "accessory",
      "sets": 3,
      "reps": "10-12",
      "rir_ceiling": 3,
      "cap": null,
      "increment": "+5/10",
      "muscle_credit": {
        "primary": {
          "biceps": 3
        },
        "secondary": [
          "grip_carry"
        ]
      }
    }
  ],
  "id": "Hammer_Curls"
}