{
  "name": "Full Range-Of-Motion Lat Pulldown",
  "force": "pull",
  "level": "intermediate",
  "mechanic": "compound",
  "equipment": "cable",
  "primaryMuscles": [
    "lats"
  ],
  "secondaryMuscles": [
    "biceps",
    "middle back",
    "shoulders"
  ],
  "instructions": [
    "Either standing or seated on a high bench, grasp two stirrup cables that are attached to the high pulleys. Grab with the opposing hand so your arms are crisscrossed about you and your palms are facing forward.",
    "Keeping your chest up and maintaining a slight arch in your lower back, pull the handles down as if you were doing a regular pulldown. The range of motion will be more of an arc. During the movement, rotate your hands so that in the bottom position your palms face each other rather than forward. Return slowly to the starting position and repeat."
  ],
  "category": "strength",
  "images": [
    "Full_Range-Of-Motion_Lat_Pulldown/0.jpg",
    "Full_Range-Of-Motion_Lat_Pulldown/1.jpg"
  ],
  "program": [
    {
      "slot": "upperA.3",
      "role": "accessory",
      "sets": 3,
      "reps": "8-10",
      "rir_ceiling": 3,
      "cap": null,
      "increment": "+5/10",
      "muscle_credit": {
        "primary": {
          "back": 3
        },
        "secondary": [
          "biceps"
        ]
      }
    }
  ],
  "id": "Full_Range-Of-Motion_Lat_Pulldown"
}