{
  "name": "Leverage Shoulder Press",
  "force": "push",
  "level": "beginner",
  "mechanic": "compound",
  "equipment": "machine",
  "primaryMuscles": [
    "shoulders"
  ],
  "secondaryMuscles": [
    "triceps"
  ],
  "instructions": [
    "Load an appropriate weight onto the pins and adjust the seat for your height. The handles should be near the top of the shoulders at the beginning of the motion. Your chest and head should be up and handles held with a pronated grip. This will be your starting position.",
    "Press the handles upward by extending through the elbow.",
    "After a brief pause at the top, return the weight to just above the start position, keeping tension on the muscles by not returning the weight to the stops until the set is complete."
  ],
  "category": "strength",
  "images": [
    "Leverage_Shoulder_Press/0.jpg",
    "Leverage_Shoulder_Press/1.jpg"
  ],
  "program": [
    {
      "slot": "upperB.2",
      "role": "accessory",
      "sets": 3,
      "reps": "8-10",
      "rir_ceiling": 3,
      "cap": null,
      "increment": "+5/10",
      "muscle_credit": {
        "primary": {
          "front_delts": 3
        },
        "secondary": [
          "side_delts",
          "triceps"
        ]
      }
    }
  ],
  "id": "Leverage_Shoulder_Press"
}