{
  "name": "Cable Rope Overhead Triceps Extension",
  "force": "push",
  "level": "beginner",
  "mechanic": "isolation",
  "equipment": "cable",
  "primaryMuscles": [
    "triceps"
  ],
  "secondaryMuscles": [

  ],
  "instructions": [
    "Attach a rope to the bottom pulley of the pulley machine.",
    "Grasping the rope with both hands, extend your arms with your hands directly above your head using a neutral grip (palms facing each other). Your elbows should be in close to your head and the arms should be perpendicular to the floor with the knuckles aimed at the ceiling. This will be your starting position.",
    "Slowly lower the rope behind your head as you hold the upper arms stationary. Inhale as you perform this movement and pause when your triceps are fully stretched.",
    "Return to the starting position by flexing your triceps as you breathe out.",
    "Repeat for the recommended amount of repetitions."
  ],
  "category": "strength",
  "images": [
    "Cable_Rope_Overhead_Triceps_Extension/0.jpg",
    "Cable_Rope_Overhead_Triceps_Extension/1.jpg"
  ],
  "program": [
    {
      "slot": "upperB.8",
      "role": "accessory",
      "sets": 3,
      "reps": "10-12",
      "rir_ceiling": 3,
      "cap": null,
      "increment": "+5/10",
      "muscle_credit": {
        "primary": {
          "triceps": 3
        },
        "secondary": []
      }
    }
  ],
  "id": "Cable_Rope_Overhead_Triceps_Extension"
}